{
  "contract": "research_candidate_graph_plan_v1",
  "format_version": 1,
  "plan_id": "candidate-plan-20260718-01",
  "source_snapshot": {
    "snapshot_id": "wikidata-20260718",
    "storage_ref": "artifacts/sources/wikidata-20260718.jsonl.zst",
    "sha256": "cccccccccccccccccccccccccccccccccccccccccccccccccccccccccccccccc"
  },
  "product_snapshot": {
    "snapshot_id": "product-20260718-01",
    "sha256": "dddddddddddddddddddddddddddddddddddddddddddddddddddddddddddddddd"
  },
  "algorithm_version": "ariadne-candidates-1.0.0",
  "configuration": {
    "sha256": "eeeeeeeeeeeeeeeeeeeeeeeeeeeeeeeeeeeeeeeeeeeeeeeeeeeeeeeeeeeeeeee",
    "values": {
      "candidate_pool_size": 3000,
      "final_target": 1500,
      "group_count": 4,
      "gray_bonus_basis_points": 2000,
      "quality_weight": 0.65,
      "grey_node_policy": "recompute",
      "tie_breaker": "stable-id"
    }
  },
  "plan_artifact": {
    "storage_ref": "artifacts/plans/candidate-plan-20260718-01.jsonl",
    "sha256": "ffffffffffffffffffffffffffffffffffffffffffffffffffffffffffffffff",
    "byte_length": 1200000,
    "media_type": "application/x-ndjson"
  },
  "summary": {
    "candidate_count": 1500,
    "edge_count": 6400,
    "group_count": 4
  },
  "created_at": "2026-07-18T04:00:00Z"
}
